Sheet: 订单格式
A1: 订单序列号 | B1: 订单用户 | C1: 地址详情 | D1: 订单手机号 | E1: 支付方式 | F1: 货品名称 | G1: 数量 | H1: 单价 | I1: 订单金额 | J1: 下单时间
A2: 20171211091011 | B2: 蒋才 | C2: 浙江省杭州市滨江区滨盛路9999号海亮大厦1801-9999室 | D2: 18606509617 | E2: 拉卡拉 | F2: 超级量子净水器 | G2: 1 | H2: 999.99 | I2: =RC[-1]*RC[-2] -> 999.99 | J2: 2017-11-11T09:10:00.000
F3: 无敌天蓝色食品优化宝 | G3: 2 | H3: 9800 | I3: =RC[-1]*RC[-2] -> 19600
F4: 女款性感量子项链 | G4: 3 | H4: 99 | I4: =RC[-1]*RC[-2] -> 297
A5: ${orderId} | B5: 蒋才 | C5: 浙江省杭州市滨江区滨盛路9999号海亮大厦1801-9999室 | D5: 18606509617 | E5: 拉卡拉 | F5: 超级量子净水器 | G5: 1 | H5: 999.99 | I5: =RC[-1]*RC[-2] -> 999.99 | J5: 2017-11-11T09:10:00.000
F6: 无敌天蓝色食品优化宝 | G6: 2 | H6: 9800 | I6: =RC[-1]*RC[-2] -> 19600
F7: 女款性感量子项链 | G7: 3 | H7: 99 | I7: =RC[-1]*RC[-2] -> 297

Sheet: 物流订单格式
A1: 订单号 | B1: 物流编号 | C1: 订单时间 | D1: 收货地址 | E1: 购买用户 | F1: 手机号 | G1: 物流仓储 | H1: 发货时间 | I1: 物流状态 | J1: 货品名称 | K1: 数量